{"$defs":{"CausalDigest":{"pattern":"^[0-9a-f]{64}$","type":"string"},"ContentID":{"pattern":"^[0-9a-f]{64}$","type":"string"},"bounded_utf8_registry_string":{"maxLength":128,"minLength":1,"type":"string"},"bounded_utf8_registry_string_256":{"maxLength":256,"minLength":1,"type":"string"},"i128s":{"pattern":"^(0|-?[1-9][0-9]*)$","type":"string"},"rfc3339_full_date":{"pattern":"^[0-9]{4}-[0-9]{2}-[0-9]{2}$","type":"string"},"rfc3339_ns_utc":{"pattern":"^[0-9]{4}-[0-9]{2}-[0-9]{2}T[0-9]{2}:[0-9]{2}:[0-9]{2}\\.[0-9]{9}Z$","type":"string"},"safe_relative_path":{"pattern":"^(?![A-Za-z]:)(?!/)(?!\\.{1,2}(?:/|$))(?!.*(?:/\\.{1,2})(?:/|$))(?!.*//)[^/\\\\:\\x00]+(?:/[^/\\\\:\\x00]+)*$","type":"string"},"sha256":{"pattern":"^[0-9a-f]{64}$","type":"string"},"sq18s":{"pattern":"^(0|-?[1-9][0-9]*)$","type":"string"},"u64s":{"pattern":"^(0|[1-9][0-9]*)$","type":"string"},"uints":{"pattern":"^(0|[1-9][0-9]*)$","type":"string"},"uq18s":{"pattern":"^(0|[1-9][0-9]*)$","type":"string"}},"$id":"urn:build-finance:contract:simulated-fill-receipt:v1","$schema":"https://json-schema.org/draft/2020-12/schema","additionalProperties":false,"properties":{"adverse_fill_bps":{"maximum":2147483647,"minimum":0,"type":"integer"},"adverse_fill_draw_key_sha256":{"$ref":"#/$defs/sha256"},"adverse_fill_draw_sha256":{"$ref":"#/$defs/sha256"},"cash_delta_quote_atoms":{"$ref":"#/$defs/i128s"},"decision_equal_time_group":{"$ref":"#/$defs/u64s"},"decision_ingest_sequence":{"$ref":"#/$defs/u64s"},"decision_sequence":{"$ref":"#/$defs/u64s"},"execution_price_q18":{"anyOf":[{"$ref":"#/$defs/sq18s"},{"type":"null"}]},"fee_bps":{"maximum":2147483647,"minimum":0,"type":"integer"},"fill_equal_time_group":{"anyOf":[{"$ref":"#/$defs/u64s"},{"type":"null"}]},"fill_event_id":{"anyOf":[{"$ref":"#/$defs/ContentID"},{"type":"null"}]},"fill_ingest_sequence":{"anyOf":[{"$ref":"#/$defs/u64s"},{"type":"null"}]},"fill_receipt_id":{"$ref":"#/$defs/ContentID"},"fill_replay_clock_ns":{"anyOf":[{"$ref":"#/$defs/u64s"},{"type":"null"}]},"filled_base_atoms":{"$ref":"#/$defs/u64s"},"gross_quote_atoms":{"$ref":"#/$defs/u64s"},"impact_bps":{"maximum":2147483647,"minimum":0,"type":"integer"},"intent_id":{"$ref":"#/$defs/ContentID"},"participation_bps":{"maximum":2147483647,"minimum":0,"type":"integer"},"portfolio_state_before_id":{"$ref":"#/$defs/ContentID"},"priority_fee_quote_atoms":{"$ref":"#/$defs/u64s"},"reason_codes":{"items":{"enum":["FILL_SAME_OR_EARLIER_EVENT","FILL_KILL_LATCHED","FILL_SESSION_END","FILL_NO_NEXT_EVENT","FILL_STALE_EVENT","FILL_NEXT_EVENT_NON_EXECUTABLE","FILL_DECIMALS_MISMATCH","FILL_ZERO_CAPACITY","FILL_PARTICIPATION","FILL_ARITHMETIC_RANGE","FILL_IMPACT","FILL_FEE_CAP","FILL_FEE_EXCEEDS_PROCEEDS","FILL_INSUFFICIENT_RESERVATION","FILL_PARTIAL"]},"maxItems":15,"type":"array","uniqueItems":true},"receipt_sequence":{"$ref":"#/$defs/u64s"},"reference_deviation_bps":{"maximum":2147483647,"minimum":0,"type":"integer"},"released_base_atoms":{"$ref":"#/$defs/u64s"},"released_quote_atoms":{"$ref":"#/$defs/u64s"},"requested_base_atoms":{"$ref":"#/$defs/u64s"},"schema":{"const":"trading.simulated-fill-receipt/v1"},"simulation_fee_quote_atoms":{"$ref":"#/$defs/u64s"},"status":{"enum":["FILLED","PARTIAL","REJECTED","EXPIRED"]},"unfilled_base_atoms":{"$ref":"#/$defs/u64s"},"venue_fee_quote_atoms":{"$ref":"#/$defs/u64s"}},"required":["schema","fill_receipt_id","receipt_sequence","decision_sequence","intent_id","portfolio_state_before_id","status","reason_codes","fill_event_id","decision_ingest_sequence","decision_equal_time_group","fill_ingest_sequence","fill_equal_time_group","fill_replay_clock_ns","requested_base_atoms","filled_base_atoms","unfilled_base_atoms","gross_quote_atoms","venue_fee_quote_atoms","priority_fee_quote_atoms","simulation_fee_quote_atoms","cash_delta_quote_atoms","execution_price_q18","participation_bps","reference_deviation_bps","impact_bps","fee_bps","adverse_fill_bps","adverse_fill_draw_key_sha256","adverse_fill_draw_sha256","released_quote_atoms","released_base_atoms"],"type":"object","x-contract-schema":"trading.simulated-fill-receipt/v1"}
