{
  "schema": "trading.simulated-fill-receipt/v1",
  "fill_receipt_id": "55a2fd87c3956c10f42b936d940e0b1824df9772ba3d814ca0a40a959dc11f0a",
  "receipt_sequence": "1",
  "decision_sequence": "1",
  "intent_id": "e22ceda9999b8dc8a4f67126968f52ffe375ff4ea4dfad9b3fbf2c59ac732448",
  "portfolio_state_before_id": "dededededededededededededededededededededededededededededededede",
  "status": "FILLED",
  "reason_codes": [],
  "fill_event_id": "abababababababababababababababababababababababababababababababab",
  "decision_ingest_sequence": "1",
  "decision_equal_time_group": "1",
  "fill_ingest_sequence": "2",
  "fill_equal_time_group": "2",
  "fill_replay_clock_ns": "1000000000",
  "requested_base_atoms": "100000000",
  "filled_base_atoms": "100000000",
  "unfilled_base_atoms": "0",
  "gross_quote_atoms": "100100",
  "venue_fee_quote_atoms": "250",
  "priority_fee_quote_atoms": "0",
  "simulation_fee_quote_atoms": "0",
  "cash_delta_quote_atoms": "-100350",
  "execution_price_q18": "1001000000000000000",
  "participation_bps": 200,
  "reference_deviation_bps": 10,
  "impact_bps": 25,
  "fee_bps": 25,
  "adverse_fill_bps": 10,
  "adverse_fill_draw_key_sha256": "47cc62feed7950f5eaf056f05bcc6e2d2c125b9ad3b85721cb348843a637e799",
  "adverse_fill_draw_sha256": "7094bd0b3317a02d9046e9baac5d66701b3ef79babc18b94fbd953227f54445c",
  "released_quote_atoms": "650",
  "released_base_atoms": "0"
}
